{
  "schema_id": "handbook.session-handoff",
  "schema_version": "1.1",
  "handoff_id": "20260714T015452Z--HCM-0-1--orchestration--dispatch-closure-review",
  "created_at_utc": "2026-07-14T01:54:52Z",
  "program_id": "handbook-contract-membrane",
  "phase_id": "HCM-0",
  "slice_id": "HCM-0.1",
  "packet_id": null,
  "session": {
    "kind": "orchestration",
    "agent": "codex",
    "thread_ref": null
  },
  "status": "completed",
  "active_resolution": {
    "level": "coordination",
    "scope_horizon": "program_control_pack",
    "detail_resolution": "architecture_and_protocol",
    "temporal_horizon": "phase_0",
    "authority_horizon": "docs_and_context_infrastructure",
    "memory_horizon": "program_record",
    "validation_horizon": "closure_review_dispatch"
  },
  "snapshot_refs": {
    "capture_status": "not_available",
    "prior_end_snapshot_ref": null,
    "session_start_snapshot_ref": null,
    "grounding_delta_ref": null,
    "grounding_projection_ref": null,
    "session_end_snapshot_ref": null,
    "session_delta_ref": null
  },
  "semantic_refs": {
    "artifact_kind_refs": [],
    "artifact_instance_refs": [],
    "intake_definition_refs": [],
    "intake_record_refs": [],
    "artifact_candidate_refs": [],
    "canonical_artifact_refs": [],
    "posture_kernel_ref": null,
    "posture_recommendation_refs": [],
    "posture_transition_refs": [],
    "default_set_decision_ref": null
  },
  "objective": "Select and validate the two-finding remediation, then dispatch a different fresh complete HCM-0.1 closure review.",
  "authority_refs": [
    {
      "path": "docs/specs/handbook-contract-membrane/handoffs/records/20260714T015043Z--HCM-0-1--documentation--renderer-projection-history-remediated.json",
      "sections": [
        "decisions",
        "validation",
        "next_session"
      ]
    },
    {
      "path": "docs/specs/handbook-contract-membrane/06-proof-and-regression-ledger.md",
      "sections": [
        "Control-pack proof gate"
      ]
    }
  ],
  "repo_state": {
    "branch": "feat/handbook-contract-membrane",
    "head": "a3babd20329027afacdcee9d8b7b9d638d15af5b",
    "dirty": true,
    "changed_paths": [
      "docs/specs/handbook-contract-membrane/handoffs/dispatches/20260714T015452Z--HCM-0-1--fresh-closure-review.md",
      "docs/specs/handbook-contract-membrane/handoffs/records/20260714T015452Z--HCM-0-1--orchestration--dispatch-closure-review.json",
      "docs/specs/handbook-contract-membrane/handoffs/ledger.jsonl"
    ]
  },
  "work_completed": [
    "Selected and validated the latest remediation handoff.",
    "Confirmed normal validation and unknown/modified/deleted-history self-test pass.",
    "Confirmed renderer-derived-view/Projection terminology assertions and docs-only scope pass.",
    "Dispatched a different fresh review-only closure session."
  ],
  "deliverables": [
    {
      "path": "docs/specs/handbook-contract-membrane/handoffs/dispatches/20260714T015452Z--HCM-0-1--fresh-closure-review.md",
      "status": "completed",
      "summary": "Ready-to-run different fresh complete HCM-0.1 closure review."
    }
  ],
  "decisions": [
    {
      "decision_id": "HCM-O-009",
      "summary": "Permit HCM-0.1 closure only on a different fresh review that retests all nine prior findings and returns clean.",
      "authority_effect": "Only the docs control-pack gate may close; runtime/open gates and seam labels remain unchanged.",
      "refs": [
        "docs/specs/handbook-contract-membrane/handoffs/dispatches/20260714T015452Z--HCM-0-1--fresh-closure-review.md"
      ]
    }
  ],
  "findings": [
    {
      "finding_id": "HCM-O-F-005",
      "classification": "proof_gap",
      "severity": "major",
      "summary": "All known findings are remediated but completed-clean-review proof still requires a different fresh result.",
      "evidence_refs": [
        "docs/specs/handbook-contract-membrane/handoffs/dispatches/20260714T015452Z--HCM-0-1--fresh-closure-review.md"
      ]
    }
  ],
  "blockers": [],
  "escalations": [],
  "validation": [
    {
      "command": "python3 handoffs/validate_handoffs.py",
      "status": "passed",
      "evidence_ref": "16 records/16 entries before orchestration closeout."
    },
    {
      "command": "validate_handoffs.py --self-test-v1-admission",
      "status": "passed",
      "evidence_ref": "Unknown, modified, deleted v1.0 rejected."
    },
    {
      "command": "git diff --check",
      "status": "passed",
      "evidence_ref": null
    }
  ],
  "pack_updates": [],
  "next_session": {
    "recommended_kind": "review",
    "objective": "Run the different fresh complete closure review; close HCM-0.1 only if clean.",
    "dispatch_required": false,
    "must_read": [
      {
        "path": "docs/specs/handbook-contract-membrane/handoffs/dispatches/20260714T015452Z--HCM-0-1--fresh-closure-review.md",
        "sections": [
          "Entire dispatch"
        ]
      }
    ],
    "allowed_scope": [
      "Read-only review/proof",
      "One v1.1 handoff/ledger entry"
    ],
    "prohibited_scope": [
      "Reviewed-file changes",
      "Rust/runtime/defaults/later slices",
      "Unrelated cleanup"
    ],
    "acceptance_criteria": [
      "All nine findings retest cleanly.",
      "Full proof passes after closeout.",
      "Clean result closes only HCM-0.1."
    ],
    "stop_conditions": [
      "Any finding leaves HCM-0.1 open.",
      "No repair in review."
    ]
  },
  "supersedes": [
    "20260714T015043Z--HCM-0-1--documentation--renderer-projection-history-remediated"
  ],
  "chat_summary": "Validated the latest two-finding remediation and dispatched a different fresh complete HCM-0.1 closure review. No Rust changed; HCM-0.1 remains open pending the independent result."
}
