{
  "schema_id": "handbook.session-handoff",
  "schema_version": "1.1",
  "handoff_id": "20260714T011043Z--HCM-0-1--orchestration--dispatch-post-remediation-review",
  "created_at_utc": "2026-07-14T01:10:43Z",
  "program_id": "handbook-contract-membrane",
  "phase_id": "HCM-0",
  "slice_id": "HCM-0.1",
  "packet_id": null,
  "session": {
    "kind": "orchestration",
    "agent": "codex",
    "thread_ref": null
  },
  "status": "completed",
  "active_resolution": {
    "level": "coordination",
    "scope_horizon": "program_control_pack",
    "detail_resolution": "architecture_and_protocol",
    "temporal_horizon": "phase_0",
    "authority_horizon": "docs_and_context_infrastructure",
    "memory_horizon": "program_record",
    "validation_horizon": "post_remediation_review_dispatch"
  },
  "snapshot_refs": {
    "capture_status": "not_available",
    "prior_end_snapshot_ref": null,
    "session_start_snapshot_ref": null,
    "grounding_delta_ref": null,
    "grounding_projection_ref": null,
    "session_end_snapshot_ref": null,
    "session_delta_ref": null
  },
  "semantic_refs": {
    "artifact_kind_refs": [],
    "artifact_instance_refs": [],
    "intake_definition_refs": [],
    "intake_record_refs": [],
    "artifact_candidate_refs": [],
    "canonical_artifact_refs": [],
    "posture_kernel_ref": null,
    "posture_recommendation_refs": [],
    "posture_transition_refs": [],
    "default_set_decision_ref": null
  },
  "objective": "Select and live-revalidate the HCM-0.1 remediation handoff, then dispatch a different fresh independent post-remediation control-pack review.",
  "authority_refs": [
    {
      "path": "docs/specs/handbook-contract-membrane/handoffs/records/20260714T010814Z--HCM-0-1--documentation--review-findings-remediated.json",
      "sections": [
        "decisions",
        "findings",
        "validation",
        "next_session"
      ]
    },
    {
      "path": "docs/specs/handbook-contract-membrane/handoffs/records/20260714T005400Z--HCM-0-1--review--control-pack-actionable-findings.json",
      "sections": [
        "findings",
        "escalations"
      ]
    },
    {
      "path": "docs/specs/handbook-contract-membrane/06-proof-and-regression-ledger.md",
      "sections": [
        "Control-pack proof gate"
      ]
    },
    {
      "path": "docs/specs/handbook-contract-membrane/08-handoff-ledger-and-escalation-protocol.md",
      "sections": [
        "Handoff schema-version routing",
        "Session closeout procedure"
      ]
    }
  ],
  "repo_state": {
    "branch": "feat/handbook-contract-membrane",
    "head": "a3babd20329027afacdcee9d8b7b9d638d15af5b",
    "dirty": true,
    "changed_paths": [
      "docs/specs/handbook-contract-membrane/handoffs/dispatches/20260714T011043Z--HCM-0-1--fresh-post-remediation-control-pack-review.md",
      "docs/specs/handbook-contract-membrane/handoffs/records/20260714T011043Z--HCM-0-1--orchestration--dispatch-post-remediation-review.json",
      "docs/specs/handbook-contract-membrane/handoffs/ledger.jsonl"
    ]
  },
  "work_completed": [
    "Selected and validated the completed HCM-0.1 docs-remediation handoff and its unique ledger entry.",
    "Rechecked the bounded remediation diff, no-Rust scope, version-routed schema/ledger proof, and unresolved need for a different fresh review.",
    "Classified the next action as proof_or_review_followup and wrote one review-only dispatch."
  ],
  "deliverables": [
    {
      "path": "docs/specs/handbook-contract-membrane/handoffs/dispatches/20260714T011043Z--HCM-0-1--fresh-post-remediation-control-pack-review.md",
      "status": "completed",
      "summary": "Ready-to-run different fresh post-remediation HCM-0.1 review dispatch."
    }
  ],
  "decisions": [
    {
      "decision_id": "HCM-O-005",
      "summary": "Dispatch a different fresh independent reviewer and permit HCM-0.1 closure only on a no-actionable-findings result.",
      "authority_effect": "The review may close only the HCM-0.1 docs control-pack gate; all runtime gates and Rust authorization remain open/absent.",
      "refs": [
        "docs/specs/handbook-contract-membrane/handoffs/dispatches/20260714T011043Z--HCM-0-1--fresh-post-remediation-control-pack-review.md"
      ]
    }
  ],
  "findings": [
    {
      "finding_id": "HCM-O-F-003",
      "classification": "proof_gap",
      "severity": "major",
      "summary": "The six known findings are remediated, but HCM-0.1 remains open until a different fresh reviewer confirms the complete pack is clean.",
      "evidence_refs": [
        "docs/specs/handbook-contract-membrane/handoffs/records/20260714T010814Z--HCM-0-1--documentation--review-findings-remediated.json",
        "docs/specs/handbook-contract-membrane/handoffs/dispatches/20260714T011043Z--HCM-0-1--fresh-post-remediation-control-pack-review.md"
      ]
    }
  ],
  "blockers": [],
  "escalations": [],
  "validation": [
    {
      "command": "python3 docs/specs/handbook-contract-membrane/handoffs/validate_handoffs.py",
      "status": "passed",
      "evidence_ref": "Full pre-dispatch version-routed record/template/ledger validation."
    },
    {
      "command": "git diff --check",
      "status": "passed",
      "evidence_ref": null
    }
  ],
  "pack_updates": [],
  "next_session": {
    "recommended_kind": "review",
    "objective": "Execute the different fresh post-remediation independent review and close HCM-0.1 only if no actionable findings exist.",
    "dispatch_required": false,
    "must_read": [
      {
        "path": "docs/specs/handbook-contract-membrane/handoffs/dispatches/20260714T011043Z--HCM-0-1--fresh-post-remediation-control-pack-review.md",
        "sections": [
          "Entire dispatch"
        ]
      }
    ],
    "allowed_scope": [
      "Read-only review of dispatch-named files",
      "One v1.1 review handoff and one ledger append"
    ],
    "prohibited_scope": [
      "Reviewed-pack/schema/validator edits",
      "Rust/runtime work",
      "Shipped-default selection",
      "Unrelated cleanup"
    ],
    "acceptance_criteria": [
      "Different fresh reviewer independently retests all six findings and the complete gate.",
      "Clean result explicitly closes HCM-0.1 without runtime promotion."
    ],
    "stop_conditions": [
      "Any actionable finding leaves HCM-0.1 open.",
      "No repair is performed by the reviewer."
    ]
  },
  "supersedes": [
    "20260714T010814Z--HCM-0-1--documentation--review-findings-remediated"
  ],
  "chat_summary": "Validated the HCM-0.1 remediation and dispatched a different fresh independent post-remediation review. HCM-0.1 remains open pending that result; Snapshot Memory is unavailable and no Rust changed."
}
