{
  "schema_id": "handbook.session-handoff",
  "schema_version": "1.1",
  "handoff_id": "20260714T014519Z--HCM-0-1--orchestration--dispatch-final-findings-remediation",
  "created_at_utc": "2026-07-14T01:45:19Z",
  "program_id": "handbook-contract-membrane",
  "phase_id": "HCM-0",
  "slice_id": "HCM-0.1",
  "packet_id": null,
  "session": {
    "kind": "orchestration",
    "agent": "codex",
    "thread_ref": null
  },
  "status": "completed",
  "active_resolution": {
    "level": "coordination",
    "scope_horizon": "HCM-0.1_exact_repair",
    "detail_resolution": "renderer_projection_and_history_integrity",
    "temporal_horizon": "phase_0",
    "authority_horizon": "docs_and_context_infrastructure",
    "memory_horizon": "program_record",
    "validation_horizon": "two_finding_remediation_dispatch"
  },
  "snapshot_refs": {
    "capture_status": "not_available",
    "prior_end_snapshot_ref": null,
    "session_start_snapshot_ref": null,
    "grounding_delta_ref": null,
    "grounding_projection_ref": null,
    "session_end_snapshot_ref": null,
    "session_delta_ref": null
  },
  "semantic_refs": {
    "artifact_kind_refs": [],
    "artifact_instance_refs": [],
    "intake_definition_refs": [],
    "intake_record_refs": [],
    "artifact_candidate_refs": [],
    "canonical_artifact_refs": [],
    "posture_kernel_ref": null,
    "posture_recommendation_refs": [],
    "posture_transition_refs": [],
    "default_set_decision_ref": null
  },
  "objective": "Validate two final-review findings, simplify the renderer/Projection boundary, and dispatch exact docs/control remediation including history-deletion refusal.",
  "authority_refs": [
    {
      "path": "docs/specs/handbook-contract-membrane/handoffs/records/20260714T013942Z--HCM-0-1--review--final-control-pack-findings.json",
      "sections": [
        "findings",
        "validation",
        "pack_updates",
        "next_session"
      ]
    },
    {
      "path": "docs/specs/handbook-contract-membrane/02-semantic-model.md",
      "sections": [
        "Projection semantics",
        "Projection provenance"
      ]
    },
    {
      "path": "docs/specs/handbook-contract-membrane/handoffs/validate_handoffs.py",
      "sections": [
        "Historical v1.0 admission mapping",
        "Record set validation",
        "Self-test"
      ]
    }
  ],
  "repo_state": {
    "branch": "feat/handbook-contract-membrane",
    "head": "a3babd20329027afacdcee9d8b7b9d638d15af5b",
    "dirty": true,
    "changed_paths": [
      "docs/specs/handbook-contract-membrane/handoffs/dispatches/20260714T014519Z--HCM-0-1--renderer-projection-and-history-deletion-remediation.md",
      "docs/specs/handbook-contract-membrane/handoffs/records/20260714T014519Z--HCM-0-1--orchestration--dispatch-final-findings-remediation.json",
      "docs/specs/handbook-contract-membrane/handoffs/ledger.jsonl"
    ]
  },
  "work_completed": [
    "Selected and validated both fresh-review findings.",
    "Classified next action as cross_document_repair.",
    "Chose terminology simplification instead of another precursor contract.",
    "Recorded fresh LOW GitNexus validator-main impact."
  ],
  "deliverables": [
    {
      "path": "docs/specs/handbook-contract-membrane/handoffs/dispatches/20260714T014519Z--HCM-0-1--renderer-projection-and-history-deletion-remediation.md",
      "status": "completed",
      "summary": "Bounded two-finding docs/control remediation dispatch."
    }
  ],
  "decisions": [
    {
      "decision_id": "HCM-O-008",
      "summary": "Reserve capitalized Projection for the Phase-3 Resolution-aware generic contract and call pre-Phase-3 fixed deterministic outputs renderer-derived views; require all admitted v1.0 history to remain present.",
      "authority_effect": "Removes sequencing ambiguity and closes the immutable-history deletion proof gap without new runtime machinery.",
      "refs": [
        "docs/specs/handbook-contract-membrane/handoffs/dispatches/20260714T014519Z--HCM-0-1--renderer-projection-and-history-deletion-remediation.md"
      ]
    }
  ],
  "findings": [],
  "blockers": [],
  "escalations": [],
  "validation": [
    {
      "command": "Fresh GitNexus upstream impact for validator main",
      "status": "passed",
      "evidence_ref": "LOW; one file caller; zero processes/modules."
    },
    {
      "command": "Source handoff and ledger validation",
      "status": "passed",
      "evidence_ref": "docs/specs/handbook-contract-membrane/handoffs/records/20260714T013942Z--HCM-0-1--review--final-control-pack-findings.json"
    }
  ],
  "pack_updates": [],
  "next_session": {
    "recommended_kind": "documentation",
    "objective": "Resolve exactly HCM-R3-F-001 and HCM-R3-F-002, then request another different fresh review.",
    "dispatch_required": false,
    "must_read": [
      {
        "path": "docs/specs/handbook-contract-membrane/handoffs/dispatches/20260714T014519Z--HCM-0-1--renderer-projection-and-history-deletion-remediation.md",
        "sections": [
          "Entire dispatch"
        ]
      }
    ],
    "allowed_scope": [
      "Exact dispatch-listed docs/validator",
      "One v1.1 handoff/ledger entry"
    ],
    "prohibited_scope": [
      "Schemas/templates/immutable records",
      "Rust/runtime/defaults/later slices",
      "HCM-0.1 closure"
    ],
    "acceptance_criteria": [
      "Renderer-derived view vs Projection boundary unambiguous.",
      "Unknown/modified/deleted v1.0 all fail.",
      "Fresh review remains required."
    ],
    "stop_conditions": [
      "Stop on scope broadening or immutable mutation."
    ]
  },
  "supersedes": [
    "20260714T013942Z--HCM-0-1--review--final-control-pack-findings"
  ],
  "chat_summary": "Validated two final-review findings and dispatched a simplified renderer-versus-Projection docs repair plus historical-deletion refusal. HCM-0.1 remains open for a different fresh review; no Rust changed."
}
