{
  "schema_id": "handbook.session-handoff",
  "schema_version": "1.1",
  "handoff_id": "20260714T012423Z--HCM-0-1--orchestration--dispatch-v1-admission-remediation",
  "created_at_utc": "2026-07-14T01:24:23Z",
  "program_id": "handbook-contract-membrane",
  "phase_id": "HCM-0",
  "slice_id": "HCM-0.1",
  "packet_id": null,
  "session": {
    "kind": "orchestration",
    "agent": "codex",
    "thread_ref": null
  },
  "status": "completed",
  "active_resolution": {
    "level": "coordination",
    "scope_horizon": "HCM-0.1_handoff_control_infrastructure",
    "detail_resolution": "validator_admission_enforcement",
    "temporal_horizon": "phase_0",
    "authority_horizon": "docs_and_context_infrastructure",
    "memory_horizon": "program_record",
    "validation_horizon": "historical_v1_admission_negative_proof"
  },
  "snapshot_refs": {
    "capture_status": "not_available",
    "prior_end_snapshot_ref": null,
    "session_start_snapshot_ref": null,
    "grounding_delta_ref": null,
    "grounding_projection_ref": null,
    "session_end_snapshot_ref": null,
    "session_delta_ref": null
  },
  "semantic_refs": {
    "artifact_kind_refs": [],
    "artifact_instance_refs": [],
    "intake_definition_refs": [],
    "intake_record_refs": [],
    "artifact_candidate_refs": [],
    "canonical_artifact_refs": [],
    "posture_kernel_ref": null,
    "posture_recommendation_refs": [],
    "posture_transition_refs": [],
    "default_set_decision_ref": null
  },
  "objective": "Select and validate the remaining v1.0 admission finding, then dispatch the smallest docs/control-infrastructure remediation and preserve independent review closure.",
  "authority_refs": [
    {
      "path": "docs/specs/handbook-contract-membrane/handoffs/records/20260714T011730Z--HCM-0-1--review--v1-routing-finding.json",
      "sections": [
        "finding",
        "validation",
        "pack_updates",
        "next_session"
      ]
    },
    {
      "path": "docs/specs/handbook-contract-membrane/08-handoff-ledger-and-escalation-protocol.md",
      "sections": [
        "Handoff schema-version routing",
        "Failure rules"
      ]
    },
    {
      "path": "docs/specs/handbook-contract-membrane/handoffs/validate_handoffs.py",
      "sections": [
        "Record version routing"
      ]
    }
  ],
  "repo_state": {
    "branch": "feat/handbook-contract-membrane",
    "head": "a3babd20329027afacdcee9d8b7b9d638d15af5b",
    "dirty": true,
    "changed_paths": [
      "docs/specs/handbook-contract-membrane/handoffs/dispatches/20260714T012423Z--HCM-0-1--v1-historical-admission-remediation.md",
      "docs/specs/handbook-contract-membrane/handoffs/records/20260714T012423Z--HCM-0-1--orchestration--dispatch-v1-admission-remediation.json",
      "docs/specs/handbook-contract-membrane/handoffs/ledger.jsonl"
    ]
  },
  "work_completed": [
    "Selected and live-validated HCM-R2-F-001.",
    "Classified the next action as cross_document_repair.",
    "Bounded the repair to exact historical v1.0 ID/content-fingerprint admission plus coupled protocol/proof wording.",
    "Recorded LOW GitNexus impact for validator main: one file caller, zero processes/modules."
  ],
  "deliverables": [
    {
      "path": "docs/specs/handbook-contract-membrane/handoffs/dispatches/20260714T012423Z--HCM-0-1--v1-historical-admission-remediation.md",
      "status": "completed",
      "summary": "Ready-to-run bounded v1.0 historical-admission remediation dispatch."
    }
  ],
  "decisions": [
    {
      "decision_id": "HCM-O-006",
      "summary": "Enforce v1.0 historical-only status with an exact immutable record ID and SHA-256 byte-fingerprint admission set; reject unknown or modified v1.0 records.",
      "authority_effect": "Makes the v1.1 new-record policy mechanically enforceable without rewriting historical records or trusting spoofable timestamps.",
      "refs": [
        "docs/specs/handbook-contract-membrane/handoffs/dispatches/20260714T012423Z--HCM-0-1--v1-historical-admission-remediation.md"
      ]
    }
  ],
  "findings": [],
  "blockers": [],
  "escalations": [],
  "validation": [
    {
      "command": "npx gitnexus impact -r handbook -d upstream Function:docs/specs/handbook-contract-membrane/handoffs/validate_handoffs.py:main",
      "status": "passed",
      "evidence_ref": "LOW risk; one direct file caller; zero processes/modules."
    },
    {
      "command": "Source review record/ledger validation",
      "status": "passed",
      "evidence_ref": "docs/specs/handbook-contract-membrane/handoffs/records/20260714T011730Z--HCM-0-1--review--v1-routing-finding.json"
    }
  ],
  "pack_updates": [],
  "next_session": {
    "recommended_kind": "documentation",
    "objective": "Implement exact historical v1.0 admission enforcement and negative proof, then leave HCM-0.1 for another different fresh review.",
    "dispatch_required": false,
    "must_read": [
      {
        "path": "docs/specs/handbook-contract-membrane/handoffs/dispatches/20260714T012423Z--HCM-0-1--v1-historical-admission-remediation.md",
        "sections": [
          "Entire dispatch"
        ]
      }
    ],
    "allowed_scope": [
      "Validator admission enforcement",
      "Coupled 06/08 wording",
      "One v1.1 handoff/ledger append"
    ],
    "prohibited_scope": [
      "Existing record/dispatch/schema/template mutation",
      "Rust/runtime/later slices",
      "HCM-0.1 closure"
    ],
    "acceptance_criteria": [
      "All seven historical v1.0 records stay valid.",
      "New or byte-modified v1.0 records fail.",
      "Full current validator stays green.",
      "Different fresh reviewer remains required."
    ],
    "stop_conditions": [
      "Stop if immutable history must change.",
      "Stop if scope broadens beyond admission enforcement."
    ]
  },
  "supersedes": [
    "20260714T011730Z--HCM-0-1--review--v1-routing-finding"
  ],
  "chat_summary": "Validated the remaining v1.0 admission gap and dispatched exact ID plus SHA-256 historical-admission enforcement with negative proof. HCM-0.1 remains open for a different fresh review; no Rust changed."
}
