{
  "schema_id": "handbook.session-handoff",
  "schema_version": "1.1",
  "handoff_id": "20260714T013253Z--HCM-0-1--orchestration--dispatch-final-review",
  "created_at_utc": "2026-07-14T01:32:53Z",
  "program_id": "handbook-contract-membrane",
  "phase_id": "HCM-0",
  "slice_id": "HCM-0.1",
  "packet_id": null,
  "session": {
    "kind": "orchestration",
    "agent": "codex",
    "thread_ref": null
  },
  "status": "completed",
  "active_resolution": {
    "level": "coordination",
    "scope_horizon": "program_control_pack",
    "detail_resolution": "architecture_and_protocol",
    "temporal_horizon": "phase_0",
    "authority_horizon": "docs_and_context_infrastructure",
    "memory_horizon": "program_record",
    "validation_horizon": "final_review_dispatch"
  },
  "snapshot_refs": {
    "capture_status": "not_available",
    "prior_end_snapshot_ref": null,
    "session_start_snapshot_ref": null,
    "grounding_delta_ref": null,
    "grounding_projection_ref": null,
    "session_end_snapshot_ref": null,
    "session_delta_ref": null
  },
  "semantic_refs": {
    "artifact_kind_refs": [],
    "artifact_instance_refs": [],
    "intake_definition_refs": [],
    "intake_record_refs": [],
    "artifact_candidate_refs": [],
    "canonical_artifact_refs": [],
    "posture_kernel_ref": null,
    "posture_recommendation_refs": [],
    "posture_transition_refs": [],
    "default_set_decision_ref": null
  },
  "objective": "Select and validate the historical-v1.0 admission remediation, then dispatch another different fresh independent complete HCM-0.1 review.",
  "authority_refs": [
    {
      "path": "docs/specs/handbook-contract-membrane/handoffs/records/20260714T012828Z--HCM-0-1--documentation--v1-historical-admission-remediated.json",
      "sections": [
        "decisions",
        "validation",
        "next_session"
      ]
    },
    {
      "path": "docs/specs/handbook-contract-membrane/handoffs/records/20260714T011730Z--HCM-0-1--review--v1-routing-finding.json",
      "sections": [
        "finding",
        "validation"
      ]
    },
    {
      "path": "docs/specs/handbook-contract-membrane/06-proof-and-regression-ledger.md",
      "sections": [
        "Control-pack proof gate"
      ]
    }
  ],
  "repo_state": {
    "branch": "feat/handbook-contract-membrane",
    "head": "a3babd20329027afacdcee9d8b7b9d638d15af5b",
    "dirty": true,
    "changed_paths": [
      "docs/specs/handbook-contract-membrane/handoffs/dispatches/20260714T013253Z--HCM-0-1--fresh-final-control-pack-review.md",
      "docs/specs/handbook-contract-membrane/handoffs/records/20260714T013253Z--HCM-0-1--orchestration--dispatch-final-review.json",
      "docs/specs/handbook-contract-membrane/handoffs/ledger.jsonl"
    ]
  },
  "work_completed": [
    "Selected and validated the v1.0 historical-admission remediation handoff and unique ledger entry.",
    "Confirmed normal full validation and deterministic admission negative self-test pass.",
    "Confirmed GitNexus change scope is LOW with zero affected execution processes.",
    "Dispatched another different fresh review-only session."
  ],
  "deliverables": [
    {
      "path": "docs/specs/handbook-contract-membrane/handoffs/dispatches/20260714T013253Z--HCM-0-1--fresh-final-control-pack-review.md",
      "status": "completed",
      "summary": "Ready-to-run different fresh complete HCM-0.1 final review dispatch."
    }
  ],
  "decisions": [
    {
      "decision_id": "HCM-O-007",
      "summary": "Permit HCM-0.1 closure only if another different fresh reviewer retests all seven findings and returns no actionable issue.",
      "authority_effect": "Review may close only the docs control-pack gate; runtime gates/seams remain unchanged and Rust remains unauthorized.",
      "refs": [
        "docs/specs/handbook-contract-membrane/handoffs/dispatches/20260714T013253Z--HCM-0-1--fresh-final-control-pack-review.md"
      ]
    }
  ],
  "findings": [
    {
      "finding_id": "HCM-O-F-004",
      "classification": "proof_gap",
      "severity": "major",
      "summary": "Known findings are remediated, but the completed-clean-review gate still requires another different fresh independent result.",
      "evidence_refs": [
        "docs/specs/handbook-contract-membrane/handoffs/records/20260714T012828Z--HCM-0-1--documentation--v1-historical-admission-remediated.json",
        "docs/specs/handbook-contract-membrane/handoffs/dispatches/20260714T013253Z--HCM-0-1--fresh-final-control-pack-review.md"
      ]
    }
  ],
  "blockers": [],
  "escalations": [],
  "validation": [
    {
      "command": "python3 docs/specs/handbook-contract-membrane/handoffs/validate_handoffs.py",
      "status": "passed",
      "evidence_ref": "12 records/12 entries before this orchestration closeout."
    },
    {
      "command": "python3 docs/specs/handbook-contract-membrane/handoffs/validate_handoffs.py --self-test-v1-admission",
      "status": "passed",
      "evidence_ref": "Unknown and byte-modified v1.0 refused."
    },
    {
      "command": "npx gitnexus detect-changes -r handbook",
      "status": "passed",
      "evidence_ref": "LOW risk, zero processes."
    }
  ],
  "pack_updates": [],
  "next_session": {
    "recommended_kind": "review",
    "objective": "Execute the different fresh complete HCM-0.1 review and close only if no actionable finding exists.",
    "dispatch_required": false,
    "must_read": [
      {
        "path": "docs/specs/handbook-contract-membrane/handoffs/dispatches/20260714T013253Z--HCM-0-1--fresh-final-control-pack-review.md",
        "sections": [
          "Entire dispatch"
        ]
      }
    ],
    "allowed_scope": [
      "Read-only proof/review",
      "One v1.1 review handoff/ledger append"
    ],
    "prohibited_scope": [
      "Reviewed-file changes",
      "Rust/runtime/defaults/later slices",
      "Unrelated cleanup"
    ],
    "acceptance_criteria": [
      "All seven findings retest cleanly.",
      "Normal validation and admission self-test pass after closeout.",
      "Clean review explicitly closes HCM-0.1 only."
    ],
    "stop_conditions": [
      "Any finding or failed proof leaves HCM-0.1 open.",
      "No remediation in review session."
    ]
  },
  "supersedes": [
    "20260714T012828Z--HCM-0-1--documentation--v1-historical-admission-remediated"
  ],
  "chat_summary": "Validated historical-v1.0 admission remediation and dispatched another different fresh complete HCM-0.1 review. HCM-0.1 remains open pending that result; no Rust changed."
}
